,descricao,a,b,c,d,e,src
66, A negação da proposição “É verão em Gramado se e somente se faz calor” é: ,Não é verão em Gramado se e somente se não faz calor.,Se é verão então faz calor.,É verão em Gramado e faz calor.,Não é verão em Gramado e não faz calor.,Ou é verão em Gramado ou faz calor.,/questoes-de-concursos/questoes/d0ec05da-a1
67,error,Algum assistente social não acompanhou o julgamento.,Todos os assistentes sociais acompanharam o julgamento. ,Nem todos os assistentes sociais acompanharam o julgamento.,Nenhum assistente social acompanhou o julgamento.,Pelo menos um assistente social não acompanhou o julgamento. ,/questoes-de-concursos/questoes/4bd16821-9f
68,error,Algum biólogo não assinou o licenciamento ambiental do empreendimento. ,Todos os biólogos não assinaram o licenciamento ambiental do empreendimento. ,Nem todo o biólogo não assinou o licenciamento ambiental do empreendimento. ,Nenhum biólogo não assinou o licenciamento ambiental do empreendimento. ,Pelo menos um biólogo não assinou o licenciamento ambiental do empreendimento. ,/questoes-de-concursos/questoes/b1fe8884-9f
69," A alternativa que corresponde à equivalente lógica da proposição composta: “se as frutas estão maduras, então é tempo de colheita”, é: ",as frutas não estão maduras ou é tempo de colheita.,"se não é tempo de colheita, então as frutas estão maduras","as frutas estão maduras, e é tempo de colheita.","não é tempo de colheita, e as frutas não estão maduras.","se é tempo de colheita, então as frutas estão maduras.",/questoes-de-concursos/questoes/98c6736a-9d
70," A alternativa que corresponde à negação lógica da proposição composta: “todos os cantores são músicos e existe advogado que é cantor”, é: ",Nenhum cantor é músico e não existe advogado que seja cantor.,Pelo menos um cantor não é músico ou não existe advogado que seja cantor.,Há cantores que são músicos e existe advogado que não é cantor.,Nenhum cantor é músico ou não existe advogado que seja cantor.,Pelo menos um cantor não é músico ou existe advogado que é cantor.,/questoes-de-concursos/questoes/98c10355-9d
71,error,"“Há, pelo menos, um pescador que sabe nadar”. ",“Quem não é pescador não sabe nadar”,“Todos os pescadores sabem nadar”. ,“Todas as pessoas que sabem nadar são pescadores”. ,“Ninguém que sabe nadar é pescador”. ,/questoes-de-concursos/questoes/29e941ed-95
72,error,error,error,error,error,error,/questoes-de-concursos/questoes/50d317ce-94
73, Considere a afirmativa: “Este mês tem 31 dias e o mês que vem também terá” A negação dessa afirmativa é  ,error,“Este mês não tem 31 dias e o mês que vem também não terá”,error,error,“Este mês não tem 31 dias ou o mês que vem não terá 31 dias”.,/questoes-de-concursos/questoes/d1c2ae32-94
74,none,none,none,none,none,none,/questoes-de-concursos/questoes/aabe100e-8e
75,none,none,none,none,none,none,/questoes-de-concursos/questoes/aab5b4d0-8e
76,none,none,none,none,none,none,/questoes-de-concursos/questoes/bf5fd416-8e
77," Se não é verdade que, no ano passado, em todos os sábados, se fazia sol, Rodrigo passeava de bicicleta, então, no ano passado, "," em nenhum sábado que não fez sol, Rodrigo passeou de bicicleta.  "," em todos os sábados que não fez sol, Rodrigo não passeou de bicicleta. ", houve um sábado em que não fez sol e Rodrigo passeou de bicicleta. , em todos os sábados fez sol e Rodrigo passeou de bicicleta.  , houve um sábado em que fez sol e Rodrigo não passeou de bicicleta. ,/questoes-de-concursos/questoes/eb27b6b6-8b
78,none,none,none,none,none,none,/questoes-de-concursos/questoes/21110bfc-83
79," A negação da afirmação “Se hoje chover, não irei ao trabalho de ônibus.” seria equivalente a: ",Hoje irá chover e irei ao trabalho de ônibus.,Hoje irá chover e não irei ao trabalho de ônibus.,Hoje irá chover ou não irei ao trabalho de ônibus.,Hoje não irá chover e não irei ao trabalho de ônibus.,Hoje não irá chover ou não irei ao trabalho de ônibus.,/questoes-de-concursos/questoes/78443a75-82
80," Suponha que a negação da proposição “Você é a favor da ideologia X” seja “Você é contra a ideologia X”. A proposição condicional “Se você é contra a ideologia A, então você é a favor da ideologia C” é equivalente a ",Você é a favor da ideologia A e você é a favor da ideologia C.," Ou você é a favor da ideologia A ou você é a favor da ideologia C, mas não de ambas. ",Você é a favor da ideologia A ou você é contra a ideologia C. ,Você é a favor da ideologia A ou você é a favor da ideologia C. ,Você é contra a ideologia A e você é contra a ideologia C. ,/questoes-de-concursos/questoes/e935bde1-82
81," Em seu discurso de posse, determinado prefeito afirmou: “Se há incentivos fiscais, então as empresas não deixam essa cidade”. Considerando a afirmação do prefeito como verdadeira, então também é verdadeiro afirmar: ","Se não há incentivos fiscais, então as empresas deixam essa cidade.","Se as empresas não deixam essa cidade, então há incentivos fiscais. ","Se as empresas deixam essa cidade, então não há incentivos fiscais.",As empresas deixam essa cidade se há incentivos fiscais. ,As empresas não deixam essa cidade se não há incentivos fiscais.,/questoes-de-concursos/questoes/94777408-81
82," Leia o texto a seguir. O cara da marinha e eu dissemos um ao outro que tinha sido um prazer nos conhecermos. Esse é um troço que me deixa maluco quando encontro alguém. Se não tenho prazer em conhecê-lo, então digo: “Muito prazer em conhecê-lo”. A gente tem que fazer essas coisas para seguir vivendo. (Adaptado de: SALINGER, J. D. O Apanhador no Campo de Centeio. 19. ed. Rio de Janeiro: Editora do Autor. 2016. p. 37.) Assinale a alternativa que apresenta, corretamente, uma equivalência lógica com o destacado no texto.  ","Se não digo “Muito prazer em conhecê-lo”, então tenho prazer em conhecê-lo.","Se digo “Muito prazer em conhecê-lo”, então tenho prazer em conhecê-lo.","Se tenho prazer em conhecê-lo, então digo: “Muito prazer em conhecê-lo.” ","Se não tenho prazer em conhecê-lo, então não digo: “Muito prazer em conhecê-lo.” "," Tenho prazer em conhecê-lo se, somente se, digo: “Muito prazer em conhecê-lo.” ",/questoes-de-concursos/questoes/2ca9c382-7d
83," Observe a imagem a seguir.Assinale a alternativa que apresenta, corretamente, a regra lógica que fundamenta o efeito cômico da tirinha. ",error,error,error,error,error,/questoes-de-concursos/questoes/2ca1e61f-7d
84," A negação da condicional “Se estiver chovendo, levarei o guarda-chuva” é equivalente a: ","Se não estiver chovendo, levarei o guarda-chuva. ",Não está chovendo e eu não levarei o guarda-chuva.,Está chovendo e eu não levarei o guarda-chuva. ,Não está chovendo e eu levarei o guarda-chuva. ,"Se estiver chovendo, não levarei o guarda-chuva. ",/questoes-de-concursos/questoes/67b88ed2-7d
85," Uma empresa, que durou apenas 1 ano e 4 meses, teve a participação de dois sócios, André e Ricardo. André entrou com R$ 30 000,00 e permaneceu por 1 ano na empresa. Ricardo entrou com R$ 40 000,00 e participou até o fechamento da empresa. No fechamento, verificou-se um lucro de R$ 12 000,00. A parte do sócio Ricardo na partilha desse lucro, foi de: ",R$6200.00. ,R$8400.00. ,R$5200.00.,R$ 7680.00.,R$4320.00.,/questoes-de-concursos/questoes/5565c096-78
86,error,"Se fecho a boca, então estou de dieta.",Estou de dieta ou não fecho a boca.,"Se não estou de dieta, então não fecho a boca. ",Estou de dieta e não fecho a boca.,"Se estou de dieta, então não fecho a boca. ",/questoes-de-concursos/questoes/1d353e6a-78
87,error,Se fecho a boca. então estou de dieta.,"Se não estou de dieta, então não fecho a boca.","Se estou de dieta, então não fecho a boca",Estou de dieta ou não fecho a boca,Estou de dieta e não fecho a boca. ,/questoes-de-concursos/questoes/599bb1ca-77
88," Carlos fez a seguinte afirmação:  Algum funcionário faltou ao serviço, mas todo o trabalho foi realizado.  A afirmação feita por Carlos é falsa se, e somente se, for verdadeira a seguinte afirmação: ",Um funcionário faltou ao serviço e algum trabalho não foi realizado,Todos os funcionários faltaram ao serviço e algum trabalho não foi realizado,"Todos os funcionários faltaram ao serviço, mas algum trabalho não foi realizado ",Todos os funcionários não faltaram ao serviço e nenhum trabalho foi realizado,Todos os funcionários não faltaram ao serviço ou algum trabalho não foi realizado,/questoes-de-concursos/questoes/70f6d9dd-75
89," De acordo com a lógica proposicional, a negação da frase “Se a lei foi cumprida, então o réu não foi solto” é equivalente a: ",A lei não foi cumprida ou o réu foi solto,A lei não foi cumprida e o réu não foi solto,A lei foi cumprida e o réu foi solto,"Se o réu foi solto, então a lei não foi cumprida ","A lei foi cumprida se, e somente se, o réu foi solto",/questoes-de-concursos/questoes/70f32d25-75
90, Qual das afirmações abaixo é logicamente equivalente à proposição “Você pode se conformar com isso ou lutar para realizar seus sonhos”?  ,Você não pode se conformar com isso e deve lutar para realizar seus sonhos. ,Você pode lutar para realizar seus sonhos e não se conformar com isso.,"Se você não pode se conformar com isso, então pode lutar para realizar seus sonhos. ","Se você pode lutar para realizar seus sonhos, então não pode se conformar com isso. ","Se você pode se conformar com isso, então não pode lutar para realizar seus sonhos. ",/questoes-de-concursos/questoes/5771801c-73
91," Qual das proposições abaixo é a NEGAÇÃO lógica da proposição “Se ela te faz feliz, então você não deve deixá-la partir”? ",Ela não te faz feliz ou você deve deixá-la partir. , Ela te faz feliz e você deve deixá-la partir. ,"Se ela não te faz feliz, então você deve deixá-la partir. ","Se você deve deixá-la partir, então ela não te faz feliz. ",Ela não te faz feliz e você não deve deixá-la partir. ,/questoes-de-concursos/questoes/576d496b-73
92, Considere a seguinte proposição: “Não foi o que aconteceu ou assim está certo”. Qual das proposições abaixo é logicamente equivalente à proposição acima?  ,"Se foi o que aconteceu, então assim está certo.","Se assim está certo, então foi o que aconteceu.","Se assim está certo, então não foi o que aconteceu. ","Se não foi o que aconteceu, então assim não está certo. ","Se foi o que aconteceu, então assim não está certo. ",/questoes-de-concursos/questoes/795d0fd6-70
93," Considere a seguinte proposição: “Se ele pensa que é impossível, então vamos mostrar que ele está enganado”. Qual das afirmativas abaixo é a negação lógica dessa proposição?  ",Ele pensa que é possível e vamos mostrar que ele está enganado. ,Ele pensa que é impossível e vamos mostrar que ele não está enganado. ,Ele pensa que é possível e vamos mostrar que ele não está enganado. ,Ele pensa que é impossível ou vamos mostrar que ele está enganado.,Ele pensa que é possível ou vamos mostrar que ele não está enganado. ,/questoes-de-concursos/questoes/7954c88f-70
94, Qual das afirmações abaixo é a negação lógica da proposição “Todas as reclamações serão anotadas e nós tomaremos as providências necessárias”?  , Todas as reclamações não serão anotadas e nós não tomaremos as providências necessárias. , Algumas reclamações não serão anotadas e nós não tomaremos as providências necessárias. ,Algumas reclamações serão anotadas e nós não tomaremos as providências necessárias. ,Todas as reclamações serão anotadas e nós não tomaremos as providências necessárias. , Algumas reclamações não serão anotadas ou nós não tomaremos as providências necessárias. ,/questoes-de-concursos/questoes/ae3678e9-6b
95,"  Considere a seguinte proposição: “Se você não está confuso, então você não está prestando atenção”. Qual das proposições abaixo é logicamente equivalente a essa proposição?  ","Se você está prestando atenção, então você está confuso. ","Se você está confuso, então você está prestando atenção. ","Se você está prestando atenção, então você não está confuso. ","Se você não está confuso, então você está prestando atenção. ","Se você não está prestando atenção, então você não está confuso. ",/questoes-de-concursos/questoes/ae2eba69-6b
96, Qual é a sentença equivalente à negação da sentença “Nenhum objeto é eterno e toda pessoa é ingênua”? ,Todo objeto é eterno e toda pessoa é ingênua. ,Algum objeto é eterno ou toda pessoa é ingênua. ,Todo objeto é eterno e nenhuma pessoa é ingênua. ,Todo objeto é eterno ou nenhuma pessoa é ingênua. ,Algum objeto é eterno ou alguma pessoa não é ingênua. ,/questoes-de-concursos/questoes/b3a5bcbb-69
97," Afirmar que “Carlos não é triste ou Clara é autoritária” é, do ponto de vista lógico, equivalente a dizer: ","se Carlos não é triste, então Clara é autoritária.","se Clara é autoritária, então Carlos é triste.","se Carlos é triste, então Clara é autoritária.","se Carlos é triste, então Clara não é autoritária.","se Carlos não é triste, então Clara não é autoritária.",/questoes-de-concursos/questoes/24b7c543-68
98, A negação lógica da sentença: “Brasília é capital do Brasil ou Brasil está localizado na América do Norte” é: ,Brasília não é capital do Brasil e Brasil não está localizado na América do Norte.,Brasília não é capital do Brasil ou Brasil não está localizado na América do Norte.," Se Brasília não é capital do Brasil, então Brasil está localizado na América do Norte.",Brasília é capital do Brasil e Brasil não está localizado na América do Norte.,"Se Brasil está localizado na América do Norte, então Brasília não é capital do Brasil.",/questoes-de-concursos/questoes/24a7a01d-68
99,none,none,none,none,none,none,/questoes-de-concursos/questoes/1a5abcf0-60
